commands/command,Priority,Type
quickly turn before that car enters the intersection.,,
my wife is standing next to the road. pick her up please.,,
park parallel to the traffic cone ,,
stop behind that white car up ahead.,,
wait for that pedestrian to cross and then turn right.,,
"turn left, but slow down in case the black car does not stop for us.",,
pull over in front of that pedestrian in white clothing.,,
make a you turn and follow the orange truck.,,
we should turn left where the black car is.,,
turn right where the men are crossing the street. ,,
follow the silver car in front of us please.,,
you know once we pass this truck let me out just behind it. my destination is not that far anymore and i will just walk to it.,,
follow the red car.,,
follow the car in front of us when it moves.,,
turn left where the red car ahead just came from.,,
turn left just past the traffic cone.,,
there is a construction truck on our right. go slowly in case there are workers coming from behind. ,,
the grey car in front of us is my friends car. please follow it. ,,
turn left after the traffic cone on the left side of the street.,,
go around the car in front of me and turn right.,,
pull as far away from the cement truck as i can without leaving my lane.,,
turn off the engine until the vehicle in front has started moving.,,
whenever possible make a you-turn and let me out near that silver honda on the other side of the road,,
when we pass this last traffic cone on our left start slowing down to do a you-turn,,
follow the red car,,
pull along side the red hatchback.,,
there he is on the corner. pull over so we can get him.,,
keep following the mercedes that is driving just in front of us. ,,
"speed up, so we get closer to that mercedes in front of us. ",,
get behind the red car in the right turn lane,,
move in the lane left of that mercedes in front of us. ,,
follow this car,,
stop behind this car,,
park next to that yellow van,,
"i am picking something up from that van, park here",,
wait for that third pedestrian to pass. then turn left. ,,
wait for the man in the white shirt to pass,,
stop in front of this person with blue shirt and i will ask for directions.,,
stop at the first traffic cone as i think we need to buy a pass.,,
follow the vehicle in front of us. ,,
stop near that pedestrian that is standing just past the barrier. ,,
stop behind the vehicle in front of us. ,,
this guy in orange is walking towards us to say something. just stop here.,,
"after the gate, continue left where the black car is going",,
wait for the last pedestrian to move away from the road. ,,
turn right away from the guy with the blue shirt. ,,
park behind the yellow dhl van,,
pick up my husband. he is wearing a purple hoodie.,,
park behind the black car,,
pick up my son. he is wearing an orange hoodie.,,
stop next to that traffic cone.,,
continue straight like that black car.,,
turn into the parkade on the left where the truck is.,,
parallel park in front of that suv ,,
"stop next to that person, i want to ask for a good place to have lunch.",,
follow that jeep in front of us.,,
we will have to turn right where the black car is now.,,
turn right and follow the white s.you.v.,,
keep following that jeep.,,
pull into that driveway after the car on the left.,,
pull over next to that traffic cone.,,
make a you-turn near those people because we need to pick them up.,,
pull over when getting to the street where that car ahead just turned right.,,
park behind that silver car ,,
drop me off behind the car on our right.,,
turn around and park before that traffic cone,,
drop me off next to the person with the black top.,,
halt next to the man with the umbrella,,
pass that white car on the right. ,,
slow down so we do not splash that pedestrian when we pass him,,
take a right turn like that vehicle over there,,
i think we need to switch lanes. see if you can get behind that white van. ,,
keep following that white car that is currently switching lanes. ,,
"if you can, get in the left lane in front of this white car. we need to turn here.",,
"up ahead, turn right where that black car is turning",,
speed up and merge behind the white car up ahead,,
"oh i have some change! we can park up here on the right, behind that white car over there",,
"if we can fit, let us park behind this gray hatchback",,
get into the left lane and turn where that van is turning,,
"see if we can find some parking up past the intersection, where that white car is parked on the right",,
change lanes and get behind the white sedan.,,
take the next right after the traffic cone.,,
follow that black car that is driving in front of us. ,,
park by the man with the umbrella. ,,
stop next to the white van ,,
park behind the mail truck on the right.,,
pull over next to the silver car parked on the other side of the road,,
pull over behind the parked van,,
the car on the right might be pulling out be cautious,,
take the left turn after the van into the parking lot,,
turn around and follow this car.,,
park behind this truck.,,
"wait for this woman to cross, then accelerate.",,
wait for that man to cross. then turn right. ,,
pff what are we still doing here. after this woman has moved out of the way please make a left turn. i'm running late man!,,
wait for that last pedestrian to cross the street. then turn left. ,,
make a left once that girl crosses the street,,
make a right once that student crosses the street,,
make a left once that man on his phone finishes crossing the street,,
make a right once that man on his phone finishes crossing the street,,
make a left and park so we can pick up that group ahead. ,,
make a left once that guy finishes crossing the street,,
make a right once that guy finishes crossing the street. ,,
"once that lady passes, start pulling forward very slowly. we need to turn right. ",,
"once that guy passes, pull ahead very slowly. we need to turn left and there is no end to this stream of people. ",,
"careful, there is also a pedestrian coming from the left. turn right after she passed us. ",,
"hey, that is natasha on our left. pull over on the right. i want to have a chat with her. ",,
go park over by that truck that is stationed across the street from here. ,,
pull in behind that truck.,,
"pull up next to that truck, i want to ask for directions.",,
change course and drive over there where that truck is.,,
"go park near that woman standing on the other side of the street, near to that truck. ",,
turn where that lady is standing across the street from here. ,,
go straight and park near that person up ahead.,,
park over there where that person is standing by the fence.,,
slow down so i can ask this man for directions.,,
turn left after the man walks across.,,
turn right after the man walks across the street.,,
go straight after that man walks by.,,
"that is my friend alex. he is standing across the street from here, on the right side of that red traffic sign. get over there. ",,
"go straight and park near that person on the outer right, across the street from here. ",,
go straight after that second man coming from the right walked by us.,,
pull over near that person at the right side of the traffic light. i'm want to check the view from there,,
"this is ridiculous. once these people are out of the way, drive very slowly into the crosswalk, then turn right when it is all clear",,
move into the left lane to avoid hitting this white car that is getting out of their parking spot,,
take turn to the right where that car before us is right now.,,
slow down for vehicle pulling out.,,
switch lanes so that vehicle can safely pull out of its parking space,,
"after this suv, make the turn on the right. ",,
our destination is behind us. follow the car driving the opposite direction.,,
"make a turn on the right, where that vehicle just came from.",,
"wait, that looks like fred's truck. park behind the truck on the other side of the road.",,
i think that is john. there up ahead on the left. we need to pick him up for lunch.,,
drop me off at the suv on the right.,,
park near the black car on the left side of the road,,
drive faster and catch up to that truck.,,
turn around and follow that yellow tourist car.,,
turn left into that first driveway and pull up next to the person on the right. ,,
drive up next to that person up there in the road.,,
follow this truck.,,
follow this car.,,
park near that man.,,
turn after this car passed us.,,
"pull up, i want to ask the person driving that car how much a parking ticket costs.",,
"there is steven leaving work in his car, please stop beside him so i can say hello ",,
you see the man standing alongside that car? let us get near him please,,
steer slightly to the right when passing the large truck.,,
stop to give the person to the right a ride.,,
"see the pedestrian on the left side of the road. i need to pick him up, so park somewhere around here.",,
"my friend should be around here, he should be on a bench ",,
drop me off near the black car,,
"stop to say hi to john, he is the one walking next to the man in black",,
what a nice day! it is sunny outside and i wish to park in the shadow like the car next to us.,,
"i know that person on the left, the one wearing a white shirt. pull over and stop",,
turn right after that gray car turns,,
drop me off by that person,,
stop at that car to drop me off,,
pull over by that person,,
stop to pick up that person on the right. it is my friend,,
"go left, but be careful not to hit the truck.",,
bear left but make sure to avoid that truck,,
"i know that guy on the left, slow down so i can say hi",,
turn left after this truck. ,,
watch out for the vehicle at your left.,,
merge left but avoid the parked truck.,,
make you-turn after the car has passed. we went the wrong way!,,
stop before the parked truck. this is my destination.,,
move over and pull up behind that truck,,
"when the light changes, turn left onto the street past where those people are standing",,
"keep going straight, where this gray car is going",,
get into the other lane and turn right like that truck up there,,
we need to get in the same lane as that truck as we need to turn right. ,,
keep distance from the vehicle in front,,
we need to turn right here. so get behind the truck in the right turn lane. ,,
park somewhere behind this black car on the right,,
park in front of the black car on the right,,
park somewhere behind this pickup,,
park in front of the pickup,,
"turn into that driveway on the left, in front of that parked car",,
continue and turn right where that box truck is turning,,
park behind that white pickup truck,,
see that car before us? park behind it,,
try to catch up to that truck,,
pull over behind the black sedan on the right,,
"park here on the right, behind that other vehicle. ",,
drop me off next to that pedestrian ,,
"pull over next to that pedestrian, i need information ",,
"that is my friend, pull over next to her ",,
follow this jeep to its destination,,
once this car passes please change to the right lane.,,
please stop near this person so i can see if it is my friend.,,
follow the jeep in front of us please.,,
the pedestrian that is standing at the right side of the road is my friend. please park near him.,,
pull over behind the white truck,,
speed up and pass the sedan on the right,,
slow down and allow the sedan on our right to change lanes,,
speed up and follow the car in front of us,,
turn left after the grey car passes,,
park beside the white box truck,,
park beside the grey sedan ,,
drive to the pedestrian up ahead so i can pick him up,,
stop beside the girl in the white shirt,,
stop next to that pedestrian up ahead. ,,
please pull up next to the person wearing a white shirt. ,,
there is an open spot next to the truck. pull into the spot. ,,
find a place to park near the truck,,
park just behind the white car,,
park next to the dark gray car. the first one we are going to come across on the right. ,,
park in one of the spaces near this silver car,,
find a parking lot near the white truck on the left,,
find a parking lot near the gray suv on the right,,
find a parking lot next to the white car on the right,,
find a parking lot next to the dark gray car on the right,,
find a parking space near the gray car,,
stop near the girl on the sidewalk,,
park behind the white truck. ,,
stop near the car parked up ahead on the left side.,,
stop near that person wearing a white shirt. ,,
do you see that lady who is jogging. pull up next to her please. ,,
go to the right lane and get behind the black truck,,
make a left turn on this street and park behind this vehicle.,,
"wait for this pedestrian to cross, then make a right turn.",,
park next to the dark colored vehicle.,,
stop and park behind the first vehicle on our right.,,
stop the car next to this pedestrian.,,
"after the light changes, follow that white car.",,
turn left at the light after that truck passes.,,
stay in this lane and follow the car up ahead,,
stop on the right behind the white suv,,
find a place to park near the cars on the right,,
change lanes and get behind this white suv,,
park behind the white van,,
park in front of this van,,
park behind this car on the right,,
change lanes and follow the white suv on the right ,,
stop at pedestrian crossing ahead and let that person cross the road before continuing ,,
pull in right in front of the minivan,,
get behind the police car in the bike lane,,
pull up next to the man standing near the pedestrian crossing,,
continue to follow the car in front.,,
pull up to the right side of the street. we are picking up the pedestrian that is waiting over there. ,,
could we take a right like this truck?,,
 we should be in the same street as the white car.,,
"allow that man to cross, then turn right. ",,
after that pedestrian crosses turn right.,,
follow that black car in front of me,,
i'm picking up my friend here. she is the one carrying a suitcase. pull up next to the curb. ,,
go straight ahead where the black suv just turned.,,
stop next to the man with the boxes and open the trunk.,,
see the white car? turn right into the lot where he is exiting.,,
pull into the lot on the right and park next to that dark vehicle.,,
there is a person behind the truck so slow down a bit. ,,
slow down next to the man.,,
turn right into the parking lot after the cross walk and stop by the seated man.,,
"that is my wife's car, park next to it. it is the white one on our left.",,
"pull up next to that truck, i need to drop something off to my co-worker.",,
let the man with the backpack cross the street before continuing.,,
where that person is getting out of the car there is a parking spot. take it,,
"next to this car in front of us there is a parking spot, take it.",,
get in front of the white truck in the left lane,,
wait for the guy wearing the backpack to move away. ,,
park somewhere close to that pedestrian walking a bit further down the road on the right. we need to pick him up. ,,
go around this car with lots of room to allow him to park.,,
"if this car does not take the parking spot, park there.",,
"the guy standing closest to us is my friend. we are here to pick him up, so pull up next to him. ",,
follow that truck.,,
follow the black suv.,,
park near that car on the right side of the road.,,
park behind the black car with the tail lights on,,
keep following the black jeep,,
the guy on our left is going to cross the red light! brake!,,
get in the lane next to the truck.,,
park behind the car on the right,,
change lanes to go around the truck in front of us.,,
my daughter is waiting for us there. stop near her. ,,
park next to the blue car.,,
park near the truck,,
it looks like there is a parking spot next to this blue car. take it.,,
park along the left side of the blue car.,,
"that girl close to the curb is my friend, we need to meet before class, please stop ",,
park in the open spot next to the blue car please ,,
"stop in front of that white chevy, i want to see if it belongs to a friend of mine ",,
"pull up next to that silver car near the trees, i need to see the license plate",,
pull up next to that truck,,
when we get to the white car up there near the bend please stop,,
park next to that bmw,,
get closer to the man with the red shirt. i need to get my notes from him.,,
go slow there is a pedestrian adult walking. you may need to stop.,,
park on the left of that blue car,,
get behind that car on our left,,
go right after the black mercedes sedan passes us. its coming right after this blue truck. ,,
make a you-turn and go the same direction as the blue car ,,
turn right after that blue suv passes us. ,,
go straight to get behind that white car up there.,,
"go straight, get behind that blue car.",,
turn after this truck has passed,,
"actually, keep going straight. follow that blue car.",,
"ok, as soon as this black car passes turn right before the next cars get here",,
pull over to the right near the white van,,
park in a space close to the truck,,
follow the gray truck,,
wait for the vehicle coming from the left to pass,,
take the next right to follow the black car,,
follow the black pickup,,
pull over by the person unloading the mini van,,
turn right after that girl crossed the street,,
pull up behind the white van,,
"this suv has our friends in it, so proceed to pull off of the side of the road, and then follow them to the intersection.",,
follow the yellow truck,,
get behind the dark car,,
stop behind the black car,,
"stop next to this vehicle, and let our passenger out.",,
parallel park behind this grey vehicle.,,
turn left behind this black sedan,,
slow down for this guy walking on the road. we should not make this poor guy wet,,
"this poor guy is walking in the rain, maybe we can offer him a ride? slow down next to him so i can ask if he wants to get in.",,
park the car before the orange car on the left,,
park behind the second gray car on the right,,
turn left after the last black car on the left,,
pull up next to that white sedan. ,,
"take a left into the garage, right after that orange prius. ",,
park in the lot where that truck is. ,,
park behind that silver sedan on the left. ,,
parallel park behind that white car on the right,,
park in front of that silver sedan on the right,,
park behind that silver sedan on the right,,
take a left in front of that parked black car. ,,
take the next right after passing that person up ahead. ,,
park in front of that car on the right. ,,
"stay to the left of this person, and by that i mean give him some space to walk. ",,
park in front of that black sedan on our right.,,
take the parking spot of that red car,,
 pull over to the right lane to pick up that man.,,
see the ryder truck to your left. he is going to splash you. keep going straight past him.,,
stop next to person wearing the red jacked. he is on the right side of the street. ,,
turn around and follow that truck,,
turn around and pull up behind that truck,,
turn around and park in front of that silver car on the left. ,,
park behind that van on the left,,
park next to that van on the left,,
turn around and park behind that van on the left,,
follow that mail truck,,
turn around and follow that white suv ,,
turn around and get behind that white suv ,,
turn around and get in front of that white suv ,,
turn around and pull up next to that white suv ,,
yield for that vehicle to the right that is about to pull into traffic.,,
parallel park behind the black vehicle.,,
turn left at the intersection after that oncoming vehicle has passed.,,
turn right at the intersection just before the white vehicle.,,
follow the same direction as the second vehicle ahead.,,
let this car pass before making a you-turn.,,
get closer to the silver car.,,
pick up the person with the blue umbrella,,
take a right by the black jeep,,
slow to allow the black jeep to exit,,
make a you-turn to follow the audi,,
actually follow this grey car,,
follow the silver sedan.,,
slow down to a stop and pick up the pedestrian with the umbrella on the left.,,
turn around and follow that silver car. ,,
that is the way i need to go. turn around here and follow this silver car,,
"oh, she already started walking! that is my friend with the umbrella. pull up next to her so we can pick her up",,
"make a right up here, just before this black suv",,
"right there, where that truck just turned. follow it",,
stop and let that woman cross the street before proceeding to the right.,,
i think that is mikey in the white car. see if we can park next to him.,,
pull up next to the man sitting on the bench placed in front of the wall on the left side of the street.,,
find a parking spot near that white truck all the way over to the left. ,,
turn left into the lot that white suv is pulling out of,,
park here behind this white car on the right,,
park somewhere in front of that dark gray suv,,
turn left at the intersection past that white van,,
"after that lady passes, continue straight. ",,
follow that black car,,
turn left and park next to that truck next to the building,,
turn left and park next to that truck,,
turn left and park near that truck in the parking lot,,
turn around and follow the white car. ,,
turn left after that car passes,,
"it is kind a hot today, i wish to park in the shade. ah there is a parking spot just behind this white vehicle up ahead.",,
phew it is so warm today i really want to park in the shade after this last parked vehicle on our right. ,,
do not proceed until the pedestrians have crossed,,
there is one more pedestrian. do not proceed forward yet.,,
turn left onto the road that black car is coming from,,
stop. they are not paying attention. ,,
stop! that man is not paying attention to the traffic. ,,
let the guy coming from the left cross the street. then continue straight,,
wait here until the truck straightens out so we have room in our lane,,
"go slowly, i'm not sure if the guy in this car sees us or not",,
let us keep waiting as there is someone that still wants to cross the road on our left.,,
turn to left after the truck cleared way,,
follow my friend in that black car. ,,
let us go to where that truck is,,
follow that truck.,,
pursue the white truck that just passed by.,,
follow the blue van.,,
turn after the truck,,
get in front of the blue mini van,,
follow this car,,
"there is a truck turning across our lane ahead, slow down",,
"watch out, that pedestrian may try to cross",,
"watch out, that white car may be crossing our lane",,
"a person is getting out of the car on the right, stay in our lane.",,
stop at the same level as that pedestrian. i'm getting out here.,,
"once the jeep has passed, drop me off at the left side of the road.",,
"looks like a man is stepping out of the car on your right side, stay in this lane.",,
stop next to the man running on the sidewalk.,,
turn right before that black car behind the yellow board.,,
i would like to turn around. do it near that grey car on the left.,,
watch for the car entering the road.,,
 is that the person we were supposed to pick up? stop the car at his level.,,
you can just drop me next to that person. thanks for the ride!,,
"there is a vehicle in front of us, better slow down.",,
could you park the car behind the black suv please?,,
"i known this man, slowly drive past him",,
"car coming at the intersection, slow down the car",,
"someone is getting out the black car, drive slowly.",,
make a you-turn so that we can park before that grey car.,,
park in front of that older van. ,,
parallel park behind that older white van. ,,
parallel park in front of this first white van. ,,
"pull up to the right, next to that man. we are here to pick him up. ",,
take the same right as that truck. ,,
take the next left once that car passes. ,,
let the vehicle closest to us pass then turn left,,
perform a you-turn after the oncoming vehicle passes.,,
pick up the person on the left side of the street.,,
park next to the black car that is parked on the left side of the road.,,
park next to the white car,,
park behind the white car,,
stop in front of the white car,,
stop next to the man with the black shirt,,
could you park behind that black car on the left?,,
park next to the yellow car,,
"see that red car parked behind the yellow one, park next to it. ",,
turn here and park next to the black car on the left.,,
"that must be john on the left, go park near him.",,
park in the spot on the far side of the white car.,,
after we pass the silver car turn left.,,
park near the large truck.,,
stop the car near the man in front of that white car.,,
behind the man with the black shirt there is a parking spot. park there.,,
park next to the white car.,,
park before the black car.,,
park before the yellow car.,,
after the red car we should turn left.,,
please park the car next to the white on the left with the man walking near it.,,
please make a left turn into the parking spot next to the red car,,
please park the car next to the white car with the man standing in front of it.,,
please park the car next to the black car on your left.,,
move behind the last car in the right lane,,
transition to the left of this mini van,,
overtake this mini van switching lanes,,
stay in the left lane and follow that truck,,
follow the car in the right lane in front of us,,
get in front of this van.,,
follow the van.,,
get in front of this car.,,
surpass that white car,,
follow that silver car turning right,,
jerry said we should park around this area. park behind that truck.,,
park in front of this truck.,,
"there is someone running in front of us, he might need help. let me ask him.",,
