commands/command,Priority,Type
"you can see two guys over on the right, behind those orange barriers. i want to talk to the one on the left, pull over close to him. ",,
could you stop a minute next to this man with his yellow shirt. i need to ask him something,,
make a stop and let this person at the crosswalk cross the road. the traffic light is on yellow anyways,,
"stop here and let that pedestrian waiting to cross, pass first",,
make a you-turn up there and follow the car that is going to pass us on the other side of the road,,
speed up so we can catch up with that vehicle in front of us. ,,
"speed up, pass this car on the left and get into the lane in front of it",,
follow that black car,,
follow that car from behind,,
pull over next to the barrier on the left,,
there is a pedestrian to the right. pull up next to the pedestrian and park.,,
"there is a pedestrian across the street from here, close to the cross walk. pull up next to the pedestrian and park.",,
there is a construction vehicle in front of us. pull up next to that vehicle and stop the car.,,
there is a construction vehicle in front of us. make a right turn before we reach that vehicle.,,
there is a vehicle approaching us. turn around when it passes us and follow that vehicle.,,
there is a vehicle next to us. match its speed and stay in this lane.,,
there is a vehicle next to us. speed up and stay in this lane.,,
there is a vehicle next to us. slow down and follow that vehicle.,,
"there is a vehicle next to us, slow down, merge lanes, and follow that vehicle.",,
"there is a vehicle next to us. speed up, and merge into it is lane in front of the vehicle.",,
there is a barrier in front of us. park directly next to that first barrier on the right.,,
"wait and let this person cross, then turn right here",,
"ok, change lanes behind that black car that just passed us",,
i do not like being this close to that concrete barrier. switch to the left lane. ,,
go through the intersection and stop on the right side of the street across from that pedestrian. ,,
wait for that car to pass. then continue straight ahead. ,,
wait for that guy to cross,,
turn left after that adult passes,,
pull up near that white construction vehicle. i want to see what they are making.,,
turn right and follow the car ahead.,,
i think i know that guy. turn left here and pull up so i can talk to him.,,
catch up with the black truck down the road,,
i think that red car is my friend's. make a you-turn and park in front of it. ,,
stop near the first car on the left side of the road. marina is waiting in that car.,,
park behind that silver car for me please,,
"there is a red car on the other side, turn around and park in front of it",,
park behind that yellow bus,,
follow that yellow bus,,
i need to park in front of that white car on the other side of the road,,
i need to park behind that crimson color car on the other side of the road,,
park behind that white car to the right,,
park next to the bike on the right,,
follow the black car in front,,
park in front of the second black car on the right,,
park behind the grey car on the right,,
"pull up next to this car, aligned perfectly, so we can parallel park.",,
merge into the left hand lane to follow this truck.,,
slow down when approaching the bus. ,,
park in front of the white van on the right hand side of the street. ,,
park behind the white van.,,
"that is my bicycle up there, close to that white car. pull over next to it. ",,
speed up to match the speed of that car driving in the other lane. ,,
"speed up to pass that car and then merge in front of it, leaving two car lengths between us.",,
merge into the adjacent lane and follow that car.,,
slow down and park in front of the second vehicle we have on our right. ,,
stay in the right lane for as long as possible past this truck. ,,
change the route and drive up to that person.  i know him and would like to say hello.,,
it looks like that person is crossing the street.  please stop until i can see if he would like to cross or not. ,,
wait for the guy on the bicycle to cross.,,
"stop next to the white truck on the left, there might be pedestrians behind it",,
do not drive too close to the vehicle as there is a traffic cone next to it.,,
"decrease speed in case someone comes up from behind of the parked vehicle, prepare for emergency stop",,
turn left onto the road next to that bicycle,,
turn right onto the road the silver car is driving on,,
"decrease speed, and keep to the right when turning left to avoid the construction vehicle",,
park in front of that truck on the left,,
carefully pass the the traffic cones on your left.,,
"the blue truck is trying to move , slow down and let him pass.",,
"keep in mind the car on your right while crossing the intersection, stop if it makes a turn right.",,
go back to the left lane once you pass the truck parked to your left.,,
stop at the corner where that bicycle is parked.,,
follow the suv straight ahead.,,
let me out near this traffic cone,,
park near the cone,,
continue straight after passing that construction vehicle,,
turn left like that black sedan,,
park beside that traffic cone,,
park beside the black car ahead,,
park behind the white car to the left,,
turn left at the black car,,
turn left and follow that truck. ,,
turn left and park next to that white car.,,
turn left and follow that black sedan.,,
get in the left lane to avoid that cone up ahead.,,
"when passing the construction board, slow down.",,
halt next to the car in front of the white car.,,
park near that person with the umbrella. let us give our friend a ride.,,
parallel park behind the gray car on the right.,,
"the construction board tells us there are constructions up ahead, better move to the left lane.",,
"slow down before we pass that person in black, i want to see if i know them.",,
park by the curb after we pass this traffic cone.,,
speed up after that last traffic barrel. ,,
there is my mom with an umbrella. pull over to pick her up.,,
wait and let this oncoming car pass,,
move in that pedestrian's direction,,
change lanes behind the bus and proceed forward,,
park next to the black truck.,,
park right across from the black truck.,,
find me a parking spot near that black truck.,,
could you please drop me off in front of that black truck?,,
turn right when we are past that black truck and find a parking spot.,,
park next to the first traffic cone on the left,,
park right across from the traffic cone.,,
find me a parking spot near that traffic cone.,,
drop me off near that traffic cone.,,
"wait for that car on the left to pull out, then follow it",,
"that is james car, slow down so i can say hi to him.",,
park next to the construction vehicle up ahead,,
turn right after the second construction vehicle.,,
find me a parking spot near that second construction vehicle.,,
could you please drop me off next to that second construction vehicle?,,
drop me off near that second construction vehicle.,,
pull out into traffic and follow that bus,,
follow that white car.,,
okay that police officer is telling us to come. let us go!,,
brake! this guy is cutting us off! what a madman!,,
see that white construction vehicle. please pull up next to it so i can give my husband his lunch. ,,
"follow that black car going the opposite direction please, it is my wife's",,
follow that bus please,,
drop me off next to the black truck on your left,,
pull over by that person standing next to the bus stop ,,
stop near that construction vehicle for a while,,
"follow that trailer, i want to have a chat with the driver",,
drive up to the construction vehicle that is closest to us. i need to get out here.,,
drive slowly. there is a construction zone on the right,,
get behind that car,,
see that huge construction vehicle up ahead. i need to get over there. ,,
i'm going the wrong way. there is a driveway after that garbage bin. pull into it and turn around.,,
drop me off in front of these bins,,
turn right and follow this car,,
"this suv is dropping off my wife, please pick her up ",,
turn right and pick up the cyclist when she stops,,
turn left where you see that gray car waiting at the junction,,
when that black car has passed make a turn to the right,,
park my car next to that construction vehicle,,
make turn to the right before passing that construction vehicle ,,
drop me off close to the big yellow construction vehicle,,
let that silver car pass before continuing to drive,,
park my car close to where that white car is up ahead the street in front of us. ,,
let that cyclist cross the road before continuing to drive,,
park behind that white truck.,,
i wish to stop near the white barrier,,
find a parking after that last white truck,,
pull over in front of that red trailer.,,
pull over in front of that yellow trailer.,,
pull over in front of that trailer next to the red trailer.,,
pull over in front of that trailer next to the yellow trailer.,,
could you get me to that construction vehicle please?,,
drop me off near that middle truck.,,
drop me off before the first truck.,,
drop me off near that last truck.,,
turn left behind the first white pickup truck.,,
park right behind the red truck container.,,
wait for the car coming from the left to pass us. then get behind it. ,,
pull up next to that trailer. ,,
move over to left lane away from the parked construction equipment ,,
move into the same lane as the truck,,
pull over and stop behind of construction barrel ,,
stop and allow this first suv  to leave and then park in it is spot,,
slow down so i can read the sign,,
move slightly left to avoid hitting the cones on the right,,
move into the left lane behind the truck,,
"if we turn around and get to the other side of the road, we might be able to park behind that white car. could you please try to do exactly so?",,
get behind this truck after it passes,,
actually make a stop after this construction vehicle. i would really want to know what they are doing to the street.,,
change lanes and get behind the silver car on the left,,
pull up closer to the gray car in front of us,,
stay in this lane as there is a construction vehicle in the other lane.,,
i wish to ask the person behind the construction vehicle what he is doing. park in front of him,,
get in the same lane as the silver car,,
pull in behind that mini van.,,
get behind that mini van.,,
follow behind that mini van.,,
pull in next to that mini van.,,
pull up next to the nearest black car.,,
park in front of the construction vehicle,,
park in the spot right after the blue construction vehicle.,,
my vehicle is standing in front of us. let me out there! ,,
do you see where the truck is? that is where we should go.,,
that  construction vehicle is where i should be helping out. you can drop me off over there. ,,
the final white car is my pickup.,,
park next to the white car on the left,,
park next to the black car,,
park next to the white van.,,
follow the truck on our left side.,,
park next to the silver car ,,
park next to the first black car.,,
park next to the white van on the left.,,
slow down and stop behind the truck for a little bit while it turns,,
park near this man,,
follow this truck,,
turn around and follow this car,,
"do not follow that van, you go straight",,
"overtake that truck, we have to go fast",,
please turn around and park next to the first car on our left,,
follow the white box truck in front of us ,,
go around the truck and turn right.,,
on the right pull over that is my friend pablo ,,
stop on the right next to pablo ,,
make a left turn after this truck passes.,,
"be careful, this truck is braking in preperation for a left turn.",,
follow this truck.,,
there is a pedestrian walking up to the crosswalk. stop and let him pass. ,,
be careful of this pedestrian walking close to the street.,,
keep following the truck that is driving in front of us.,,
that truck is going to turn but we need to continue. overtake it please,,
"hi car, take me to the construction vehicle.",,
"i need to be inside the building on the right, could you please pull up behind the traffic cone in front of it.",,
"traffic cone in our lane, move a bit to the left.",,
watch out! we are going to hit that traffic cone!,,
move to the left! there is a traffic cone that fell over!,,
just drop me off near that second big cone. i'm going by foot!,,
park behind this traffic cone ,,
move a bit to the left as there is a construction vehicle close to our lane.,,
it is the first time i've been in this place. follow that car next to us.,,
"that car in front of us is driving like a madman, better keep our distance.",,
i need to be near that construction vehicle. thanks for the ride!,,
i wish to ask something to the lady wearing something white,,
we should get to where that black car coming from the left in the far distance is. ,,
turn left past this orange construction machine,,
turn right where the arrow on that barrier is pointing,,
"continue straight, on the street to the left of that motorcycle",,
"when it is clear, turn and follow that van",,
drive closer to the construction vehicle. you will be making a left.,,
prepare to turn after the traffic cone.,,
stop to pick up passengers.,,
speed up past the bicycle.,,
watch for trucks in the work area.,,
turn right and try to park next to that barrier.,,
drive around the traffic cone to go to the right.,,
park near the curb to pick up the pedestrian.,,
stop near the bike. i need to pick it up.,,
stay in this lane as there is a construction vehicle in the other lane.,,
slow down and watch out for that man crossing the road up ahead.,,
"slow down near that construction equipment, there may be debris.",,
stay left so you do not hit that cone.,,
turn right after that construction truck.,,
"that cone is close to our lane, be careful not to hit it when turning right.",,
slow down for the construction worker.,,
park close to the pedestrian on the left.,,
"keep to the left, away from the cones.",,
slow down when passing next to the traffic cones.,,
start turning slight right after this cone,,
stop at cross walk for pedestrian,,
stop at the truck on your left and see if john is there. ,,
keep right to avoid that cone we are about to hit on our left,,
keep to the right till we are past that second cone.,,
"slow down, there is a barrier just behind that last cone.",,
park beside  the motorcycle up ahead,,
follow the bus. ,,
follow the car that is crossing the intersection in front of us,,
stop for the lady and allow her to cross the street,,
do you see that white van on the intersection? please follow it.,,
turn right after passing the truck. ,,
stop near that construction vehicle,,
near the construction vehicle take a right turn,,
move over to the left and pull up behind the construction vehicle. i need to help out over here. ,,
move a bit to the right. i am afraid of debris falling from that truck. ,,
follow the white car going left.,,
"careful, the car in front is slowing down",,
"looks like we have to go left, keep following this white car",,
slow down so i can see why they are using this construction vehicle.,,
that car is braking! brake too!,,
"once we get past these traffic cones, get in the right lane",,
bear left to stay behind this car,,
keep following the white car.,,
park next to the truck.,,
turn left to follow the vehicle.,,
we need to go left but there is a person standing next to the truck.,,
be careful i think that woman closest to us wants to cross the street.,,
follow the white and black car when the light turns green.,,
turn left after the construction vehicle ,,
park beside the construction vehicle,,
slow down while we drive past the construction equipment,,
drive straight past the heavy machinery,,
"we are near the construction site, please find a parking space nearby",,
go around the construction vehicle and continue on route.,,
let the man cross,,
i know her! turn around and stop next to the sidewalk.,,
it looks like there may be a spot behind that white car. turn around and see if we can get it.,,
pull up behind that black truck on the right so i can hop out.,,
"i think that is my friend up on the right, slow down so i can see if it is her.",,
pull over on the right after that last traffic cone.,,
find a place to you-turn and follow that blue car.,,
"pull over next to that black truck, please.",,
please stop near my friend on the sidewalk.,,
let me out at the crosswalk near the man in the yellow shirt.,,
stop and wait next to the first black car,,
merge into the left lane before we get to that first cone,,
pull over and park behind the black pickup,,
park behind the black suv,,
slow down and wait for that pedestrian coming up from the right to cross the street as well. ,,
"slow down, i want to have a look at that construction vehicle. ",,
stop near the last trailer on the right,,
my friend tom is inside the white truck on our left. stop near it.,,
park next to the construction vehicle.,,
pull over in front of that trailer.,,
drive over to that trailer.,,
park behind the beige trailer.,,
take the left before this white utility truck.,,
turn left after that white pickup truck.,,
find a place to park in front of that white car.,,
pull up alongside that grey car.,,
take a right turn before this green trailer.,,
take a left into the parking lot before that traffic cone.,,
park behind this trailer ,,
look for parking space near that second trailer,,
 parallel the car along these traffic cones then stop ,,
park the car in front of the trailer ,,
make a you turn then stop the car near this trailer at the other side of the fence,,
find parking space near the trailer on the left. ,,
get to that construction vehicle if you can. ,,
park behind the white utility truck,,
park next to the utility truck,,
stop at the yellow cargo truck trailer,,
turn left after white truck on the left,,
"park in front of the white truck, two spots away from it",,
turn left into this driveway right after the blue bin,,
"let this woman pass, then turn left",,
speed up to get closer to the yellow car,,
"pull over here, just before the green bin",,
"park here on the right, somewhere in the space in front of that green bin",,
"turn left here, just after this blue bin",,
"up ahead, turn right where that white suv is going",,
 pull over in front of that green bin,,
drive up to the yellow car,,
when this lady has crossed the road make the turn,,
park next to the green garbage can,,
"there is julie on the left, stop to pick her up ",,
turn left by that man up ahead.,,
wait for pedestrian to cross,,
park near that first truck on the parking lot to the left,,
parallel park near the first trash can,,
follow that truck,,
pull in and park beside the trailer.,,
stop and let the pedestrian cross the street.,,
stop at the intersection to let the passenger enter the vehicle.,,
make a you turn and follow the silver car. i mean the second one you see going the opposite direction. ,,
turn in and park on the left side of that trailer,,
park on the sidewalk near that person to the left,,
pull up next to that garbage can on the left,,
park next to that object on the left.,,
park next to that green trash bin near the tree on the left.,,
follow the vehicle in front of us.,,
try to pass this vehicle if there are no vehicles coming toward us in oncoming traffic.,,
make a complete stop until that vehicle has cleared the road.,,
pass this car as soon as possible,,
mhh this car is slowing down. there must be something up ahead. let us slow down too.,,
this green garbage can stands in front of my home. drop me off next to it.,,
find me a parking spot next to the blue garbage bin on the left. ,,
"slow down and drop me off next to the big, blue can on the left.",,
find me a parking spot next to the dark colored car on the left.,,
drop me off next to the dark car on the left.,,
slow down and drop me off next to my friend on the left.,,
pick up my friend walking ahead on the left.,,
follow the yellow car.,,
find a good place to park after we pass the green trash can,,
drive to that car that is parked in front of that house.,,
turn right where the silver vehicle is.,,
turn left before the trash can.,,
"my contact is walking down the street, let me out next to him.",,
stop next to the blue garbage can. i need to take the garbage out. ,,
turn into the driveway that the taxi is passing,,
that is kevin on our right! let us drive and say hi to him,,
take the same right as that taxi,,
wait that is not kevin...cancel the pickup and continue straight,,
"make a left into sam's driveway after, its the one right after that garbage can. ",,
take a right onto that street where the audi pulled up ,,
pick up randy,,
park behind that car up ahead,,
park in front of that car up ahead. ,,
take a right where that truck is. ,,
"stop next to the blue recycling bin, i need to take the recycling out",,
pull into the driveway after the green recycling bin,,
take the next right after the second recycling bin,,
take a left turn before that bin and enter the gate.,,
turn right where that car is coming from. ,,
turn on the left turn signal and turn left after this blue garbage can.,,
turn right and follow this car.,,
make a left turn before this second trash can.,,
be careful of this vehicle about to pull out.,,
signal a right turn and turn right after this vehicle pulls out.,,
stop the vehicle next to this pedestrian.,,
park behind this vehicle and turn the car off.,,
stop and let the car pass,,
"slow down, this driver is light calling me",,
light call the car on the right. the driver forgot to put on his headlights,,
my driveway is behind the trash can. drop me off there.,,
keep your distance from the car that is driving without it is headlights on.,,
"stay behind eric's car in front of us, he knows where to go.",,
slow down as we pass that car.,,
park near that car.,,
stop after we pass that car.,,
pull in behind the car on the right,,
park behind that car on the right.,,
what a madman! he is driving without lights. flash our lights!,,
flash our lights to this car so he knows there is a speed control up ahead.,,
"go slow when we go by that car, i think i know who is driving.",,
"slow down, i want to try and get that drivers attention, i think it is my mom's neighbor.",,
"turn here just before the movable object, i need to make a pit stop.",,
"i need you to stop at that white car, i'm supposed to drop something off to a coworker.",,
"stop over there next to that object on the corner of the street, that is where i told my brother to meet me.",,
turn where that car is parked.,,
"pull over so i can see if that is a trashcan, i want to get rid of something.",,
wait for the opposing car to complete its movement before turning left. ,,
stop behind the truck in front of us,,
take the same left as that black car. ,,
follow the car taking a left right now. ,,
pull into that lot where the recycling bin is. ,,
take a right where that silver car is parked. ,,
park before the first car on our right,,
"pull up behind that silver car for a second, we need to pick sam up",,
take a right after that truck up ahead,,
take a right before that truck up ahead,,
frank said he is parked right before the overhead walkway connecting two buildings. drive to that car and stop parallel to it.,,
drop me off near the silver car near the buildings.,,
take a left to follow the black car,,
find a place to park near the silver car on the right,,
drop me off near the parked silver car,,
stop to let out the silver car,,
park behind the cars on the right,,
drop me off behind the truck flashing its warning lights,,
park near to the truck flashing its warning lights,,
take a left and follow that car when the traffic is clear,,
turn left after the oncoming car has passed us,,
park behind the first car on our right,,
wait until the vehicle in front of us is at safe distance then proceed to follow it ,,
find parking space behind the first car up ahead parked along the right curb. ,,
traffic light turned green please move forward along with that gray car in front of us.,,
follow this vehicle.,,
make a right turn after this barrier.,,
be careful of this vehicle driving too closely.,,
accelerate in order to decrease the distance to the vehicle driving up ahead in our lane. ,,
beware of this human about to cross the street.,,
stop the car next to this object.,,
park behind the first vehicle on the right. ,,
switch lanes and get behind the white vehicle.,,
"there is jim, pull up on the right a bit further down the road so we can offer him a lift ",,
park on right the up ahead behind the suv ,,
"wow, do not go to fast. we need to pull over by that guy standing on the sidewalk over on the right. he needs to ride with us. ",,
stop at the curb by the trash can! i need to throw something away!,,
"slow down so i can say hi to that man, he is my neighbor.",,
turn left at the next driveway before the trashcan.,,
make a right after the next trash can.,,
"stop as soon as it is safe, unlock the doors, and let me pick up my friend.",,
make a right into the driveway near the next trashcan on the right.,,
follow the truck in front of us to the next location.,,
slow down to give the van in front of us time to complete his turn.,,
stop to pick up my friend,,
park near the man,,
pull up next to that green trash bin. ,,
park onto the first driveway on the left with the bin outside of it,,
start following the truck,,
hey make a quick stop at the blue bin over there. i'm going to drop something in it.,,
slow down once we pass this man as there is a hump up ahead.,,
