commands/command,Priority,Type
"we need to turn left, move to the left side of the vehicle in front of us. ",,
park in front of the first car we have on our right,,
pull over next to the second car you come across on your right. ,,
park behind the first car you have on your left. ,,
cross the double-yellow-line and pull over next to the first white truck. double-park but leave the engine running.,,
flip a you and park behind that last white truck.,,
cross the double yellow line and park behind that black car.,,
park in front of the gray jeep on the right,,
find a place to park near that yellow barrier over to the right,,
find parking behind the white van on the left,,
that is mike's car! parallel park behind the first car on the left.,,
remain here and wait for kyle to exit from the first vehicle on the left,,
"slow down, this car might be pulling out of the space.",,
park here in front of this blue jeep,,
it looks like we are allowed to park on the opposite side too. park in this space on the left behind this black car,,
pull over here near this barrier in the middle i need to check something,,
drop me off near my sister that is walking on the left side.,,
park behind the lory.,,
the depot is where that barrier is. get me to there.,,
pick up tom. he is sitting on the bench under the tree on our left. ,,
drop me off near my coworker who is walking to the left of us,,
follow the truck ahead ,,
"that is my partner, turn around and follow that white van please.",,
turn left and park near the first barricade on the left. ,,
follow that van,,
follow that vehicle,,
follow that car,,
turn left after that van passes,,
wait for that woman to cross the road,,
please wait for that pedestrian to cross the road,,
park next to that woman,,
park next to my friend who is walking on the other side of the road. ,,
turn left after that woman,,
pull over next to that person,,
pull up behind that pedestrian.,,
continue straight and follow the silver suv.,,
pull over next to the red barrier.,,
stop the car next to that red barrier.,,
take the left before that red barrier.,,
please switch to the lane next to the white barrier.,,
please switch lanes after we pass the traffic cone.,,
"pull over near that bike, it looks just like the one i recently lost!",,
"stop the car on the road to the left, in front of that person.",,
find me a parking spot near that bike. ,,
drop me off next to that construction barrier. ,,
continue straight to follow that silver suv. ,,
"i see my friend over there, stop the car next to him. ",,
"my coworker is right there, stop the car near him. ",,
turn left before the cement block,,
"get into the right lane, next to the orange and white blocks",,
we should slow down as there is a person approaching our road.,,
i have an appointment where that person is walking now. ,,
stop i need to get my bike,,
make a left turn and go past that concrete barrier.,,
make a you-turn and follow that white taxi passing us on our left side.,,
go to where the woman on the crosswalk is.,,
"after the traffic cone, turn left.",,
follow the black car.,,
get behind the silver bmw.,,
make a you-turn around the traffic cone,,
take a left where the person is crossing the road,,
"i've changed my mind, we should follow this jeep in front of us",,
see that pedestrian over on the left corner. we need to pick him up from work. ,,
turn left but stop yield to the man walking over there. ,,
stop by this cone,,
follow the pace and the direction of the car in front,,
follow this grey sedan,,
turn to the left lane in order to avoid the barrier in our way,,
drop me off near my colleague who is walking on our right side.,,
switch to the left lane in order to avoid this construction cone,,
drop me off near my colleague who is walking on our right side.,,
pull into the left lane after passing the car on our left,,
pull into the right lane after the barriers on the right,,
turn left behind the car ahead,,
stop and let that woman cross the road. ,,
"there is my friend, pull over next to him",,
"that is tim, slow down and let me say hello.",,
go to the left lane and follow the gray car,,
pick up my friend who is standing at the pedestrian crossing.,,
"those cones are close, move into the next lane.",,
follow the bigger white truck ahead of us.,,
stay in the lane behind the white truck.,,
turn right after those barriers.,,
turn left after that big truck clears the intersection.,,
turn left and park after that big truck on the left.,,
turn right and park after passing those traffic cones.,,
follow this white pick-up,,
follow this truck,,
get closer to the pick-up,,
make a you-turn and stop at the barrier at the other side of the road.,,
    remain to the left of the bicycle in front.,,
slow down for the bicycle in front ,,
pull over next to the concrete barrier right of the guy on the bike. ,,
slow down by the bicycle ,,
pull over here behind the first concrete barrier,,
"wait for the oncoming car to pass, then speed up to pass the biker",,
"slow down, let the biker pass, then pull over here",,
drive over the curb slowly and park next to the suv.,,
overtake the cyclist in front ,,
pull up next to the truck on your left.  i would like to ask the driver a question.,,
i prefer to turn right like that white car.,,
let the truck next to us pass first and then get into its lane.,,
get into the right hand lane so we can follow the white suv,,
change lanes so i can see who is driving that car,,
stop by the barrier on the right.  i'm meeting someone there.,,
change directions and follow that white suv,,
follow the car going right,,
change lanes and follow the black car in the lane right of us.,,
actually we should go where that pedestrian is walking on the road.,,
get before the bus.,,
"change of plans, make a left by that white barrier.",,
"i think ryan takes that bus, let us follow it so i can offer him a ride.",,
"hey that is my mom's orange car, follow it.",,
"proceed straight through the intersection, and go down the street that silver car is",,
"i know the person at the bus stop on the right, pull over next to him.",,
i want to turn right and park next to this car.,,
"i have spray paint and want to tag this barrier, pull over now.",,
follow that car.,,
pull up alongside the first concrete barrier on the right,,
follow the car coming from the left. ,,
turn right into the parking lot by that black car on the right.,,
park beside this man at the bus stop,,
slow down as that black car before us is just getting into our lane.,,
change lanes just as the black car before us.,,
park behind the car on the right,,
a truck is stopped in the right lane. move into the left lane,,
"pull up behind the black car on our right, parked next to the white truck",,
to be safe pull in the parking place behind the white truck and wait,,
follow the blue truck beside me,,
get behind the silver suv beside me ,,
get in front of the white car in the far right land,,
park beside the concrete block on the left side of the road,,
pull over by the first orange cone,,
follow the blue truck that just passed us,,
pull up behind that silver vehicle coming up on our right,,
follow the silver vehicle that just passed our left,,
watch out for the white truck in front,,
"i need to stop for a moment, pull up behind that van on the right",,
change lane to cautiously pass the parked delivery truck.,,
turn left after passing the orange cone.,,
change track and follow the gray car on the right.,,
"this guy next to us is driving rather dangerously, could we please slow down and keep some distance",,
get in the same lane as the vehicle driving in front of us,,
"hey that is my friend over there by the sidewalk near the trees, park my car as close as possible ",,
"see that silver car, when you pass it make the first turn to the left",,
"that grey car has my friend in it, keep following it as we are going to the same restaurant",,
after passing that barrier make the first turn to the right,,
try to park the car next to that barrier over there,,
match the speed of the car ahead and get behind it. ,,
turn left and follow the silver suv.,,
turn left and follow the grey suv.,,
keep following the guy on the bike.,,
park behind the white truck.,,
park behind the grey car.,,
make a turn after this cyclist,,
turn right where that car is coming from,,
continue on the road where the pedestrian is crossing,,
i need to go to a shop somewhere around here. park next to that barrier up on the left. ,,
find a parking spot next to that barrier.,,
stop next to that barrier on the left so i can get out.,,
go straight after that car passes.,,
that is my husband's car. find a place to turn around and follow him.,,
turn left after that car passes.,,
go straight after that person crosses.,,
"wait for that person to cross, then turn left.",,
that is john. stop here to let him in.,,
that is the man i'm looking for. find a place to park near him.,,
i need to pick up that person. turn left here.,,
there is mary. find a parking spot next to her.,,
"i need to follow that car, turn around at the next intersection and follow it.",,
"wait for that car to pass, then go straight.",,
"wait for that car to pass, then turn left.",,
"wait for that car to pass, then follow it.",,
"wait for that bike to cross, then turn right.",,
turn right after that bike crosses the road.,,
turn right after that man crosses the road.,,
turn right after that person crosses the street.,,
"wait for that man to cross the street, then turn right.",,
"let the man pass, then turn right.",,
"wait for that man to cross, then go straight.",,
"let that person cross, then keep going straight.",,
"wait for that man to pass, then keep going straight.",,
park next to the guy with the brown t-shirt.,,
stop by that man so he can get in the car.,,
that is the man i'm meeting. stop here and let me out.,,
find a parking spot next to that man.,,
"find a place we can turn around, then follow that black car.",,
find a parking spot next to that car.,,
find a parking spot next to that pedestrian on our left.,,
park behind that truck.,,
pass the truck and turn right up ahead.,,
pass that white truck and turn left.,,
turn left after we pass the white truck.,,
turn right into the parking lot past the last car.,,
parallel park behind that gray car.,,
that is the car i'm looking for. stop behind it.,,
park somewhere behind the gray bmw,,
please park behind that white truck.,,
catch up to that car up ahead please.,,
get right behind the cyclist on the corner and turn right,,
"wait for the guy in red shirt to cross, then go straight ahead after he cleared way. ",,
we are going to make a right just after that truck up ahead.,,
follow the black car coming from our right. ,,
turn to the left after that third incoming car has passed.,,
we need to follow the truck that is driving way up ahead. ,,
"we are in the wrong lane, if safe can you pull to lane on the right behind the grey nissan?",,
could we maybe park where that white car is right now? i really need to go to the toilet.,,
"drop me off on the sidewalk to the right, next to that last concrete barrier",,
"after the next crossroad, keep the right track like this car",,
"go to the right turn lane, behind the black car over there",,
follow that car going left.,,
"slow down, prepare for emergency stop if person walks into road",,
"slow down, prepare for emergency stop if person walks into road",,
"slow down, prepare for emergency stop if person walks into road",,
turn left after the person has crossed the road.,,
pick up that pedestrian in the black shirt standing near the road.,,
stay clear from that person on the road,,
slow down until that pedestrian has crossed,,
"there is a construction sign ahead, we should slow down but continue straight ahead.",,
that woman over there looks like she might try to cross the street. let her pass.,,
"one more person just stepped out to cross the street, be sure to let him cross before proceeding.",,
"as we turn, look out for that construction barrier as the lane may be narrower.",,
"hey, that is my friend fred waiting. stop the car to pick him up.",,
that woman in black is my friend stacy. pull over to the curb just beyond her so we can offer her a ride.,,
wait for that car to finish turning before we turn.,,
there is another pedestrian trying to cross the street. wait for him to get across the crosswalk before we move.,,
stop before that person as they want to cross the road.,,
follow the white car on our left.,,
we need to pick up the pedestrian that is walking over there.,,
park in front of that black car if you will.,,
see that grey car on the left side of the road? park over there please.,,
parallel park in front of that black sedan.,,
turn left after the orange barrier.,,
slow down so i can look at that person in front. ,,
park in front of the black car. ,,
follow that van.,,
park behind the white car. ,,
"park next to the person in front, so i can talk to them.",,
flash bright lights towards the car in the opposite direction.,,
go where  you can see that truck up ahead. ,,
stop here. let that car go and take a right turn and continue for 100 meters.,,
if this grey car is not my wife's car please keep going. she is driving a red car.,,
if this white van is not my wife's car please keep going. she is driving a blue car.,,
if this is not my wife's car please keep going. she is driving a black car,,
pull up next to that pedestrian standing by the bus stop. ,,
park in front of the vehicle on the left.,,
stop the car next to this pedestrian.,,
"allow this pedestrian to cross, then turn left.",,
put on right turn signal and switch lanes behind this vehicle.,,
be careful of this vehicle in the right lane. i wish to overtake it.,,
stop the car in front of the bus stop and pick up this pedestrian.,,
"be careful, this vehicle is braking suddenly.",,
park in front of this white van,,
"wait for this pedestrian in the blue shirt to cross, then turn left here",,
pull over and stop next to these barriers,,
get into the right lane behind this silver car,,
the person sitting by the bus stop is my colleague. pull over so we can pick him up. ,,
"that is john, stop next to him",,
that car is driving way to fast. stay behind it. ,,
"that is my husband in the black shirt, stop right now",,
follow the car ahead,,
get in the same lane as that car to our right,,
make a stop at that barrier,,
follow the dark car in front of us.,,
could we please overtake this car in front of us? i do not like to be behind them.,,
"where that car in front of us is, there is a road. take it",,
follow the car in front of us to its destination,,
please follow that red car.,,
turn left where that red car is going,,
please turn left after that barrier,,
please find a parking spot near that barrier.,,
drop me off before we reach that barrier please.,,
find a right turn after that barrier.,,
please find a parking spot near that barrier.,,
find a left turn after that barrier.,,
can you please stop near that barrier.,,
please turn right after that barrier to the left.,,
please find a parking spot near that barrier.,,
drop me off before we reach that barrier please.,,
find a left turn after that barrier.,,
find a right turn after that barrier.,,
"there is a bus stop after that barrier, drop me there.",,
"park on the bus stop before that barrier, barry is waiting for us there.",,
watch out for that car in the lane to your left.,,
change lanes and get behind that white van coming into the intersection.,,
"when the light turns green, turn left onto the street where the dark van is going.",,
go straight ahead and stop near the pedestrian in a black shirt on the other side of the intersection.,,
pull up next to the white van,,
get behind the van.,,
once the car has passed we can cross the road.,,
drive slowly as that car is turning.,,
move into the left lane behind that car.,,
wait for that car to finish turning before you go through the intersection.,,
do not hit that traffic cone when you move over into the other lane.,,
pull up next to the van in front.,,
follow the white van on the left.,,
"move to the left lane, right next to that barrier.",,
follow the car in front of us.,,
stop behind that bus parked there.,,
switch to the right lane and get behind the orange car.,,
"stop near that barrier and wait for me, i will return in a minute.",,
"oh, i see my daughter. she is walking on our left, stop next to her.",,
speed up and pass the red vehicle on our right,,
there is the bus my kid should take! stop behind it!,,
"my boyfriend should be near the trees he told me. if you see him, park near him.",,
"what, there is a barrier in my road! damn! continue straight ahead then.",,
slow down for that black car and let it go before us. ,,
move into the same lane as the suv on the right.,,
pull up next to the white barrier,,
park where that bus just left. ,,
follow the bus,,
increase speed after passing cone,,
pull over and let me out at the second white barrier we have on our right,,
pull over and pick up my friend. he is the one waiting in the middle in the grass.,,
let me out after this yellow car please,,
i'm meeting my date at this barrier next to us. could you please let me out near it?,,
hey that person is having some problems! stop so i can ask if he needs help.,,
slow down and park next to the yellow vehicle on the left side of the street.,,
stop so i can pick up my friend,,
"i'm looking for someone wearing a white shirt, stop next to that guy so that i can check if that is him",,
slow down and wait for that pedestrian to cross.,,
"we are about to cross a pedestrian, slow down. i need to ask him for directions. ",,
pull up behind the black car that is parked alongside the curb. ,,
"after this black car, turn right",,
i'm meeting a friend he said to park near that legal building where he will be waiting out front.,,
pull up next to the vehicle waiting in front of the pedestrian crossing,,
"pull up next to this black car on our right, the one parked just behind the silver one. ",,
"if possible, turn right after that last parked car",,
do you think it would be possible to let me out at the orange barrier? ,,
park after that black suv on the right,,
that is my car. park next to the suv on the left,,
make a turn and go behind the black car coming from the opposite way ,,
stop at that truck,,
park in front of the cone,,
follow that car,,
pull over alongside that barrier,,
stop when you are near that truck.,,
"please stop next to this man, i need to talk to him.",,
could you please let me out near the truck?,,
could we please turn in the same direction as this car before us,,
take the street where the car is coming from.,,
turn left after the truck.,,
turn left just behind the truck on the left,,
follow  the gray vehicle in front of us,,
turn left after they gray vehicle,,
let me get down by the first barrier on the left,,
turn after the barrier.,,
continue forward after traffic cones,,
park by the right barrier that is posted along the street,,
park near the closes barrier on the right,,
"that is my wife's car, follow behind it. ",,
turn into the right lane behind this big black truck,,
stay in the left lane until we can pass that postal truck. ,,
turn into the right lane after passing the last barrier. ,,
see those people up ahead and to the left? we need to turn left there and drive past them. ,,
continue straight and drive around that turning car. ,,
"pull off to the right, we need to pick up grandpa. ",,
overtake this mail truck before us.,,
"pull off to the right, we need to pick up stacy.",,
let man cross the road,,
park behind that large black truck. my office is around here. ,,
"pull over here, next to this cone",,
park behind this black truck,,
pull up behind the mail truck,,
pass the mail truck and get in the right lane,,
pass the suv ahead and follow the silver truck in the distance,,
get behind this suv in front of us and turn left when it does,,
stop and let this guy pass,,
pull over next to this woman,,
stop behind that truck.,,
park behind the white truck. ,,
turn left at the leftmost barrier up ahead. ,,
"slow down, let the car pass",,
follow that car,,
let the truck pass first then continue straight ahead,,
park next to that silver car on our right,,
make a uturn and follow that truck,,
follow the work truck.,,
follow the silver car.,,
follow that car.,,
i changed my mind. check that it is clear and follow this truck.,,
"give these trucks lots of space, they may have a wide load.",,
stop at the intersection where that car is crossing the street.,,
wait for that truck to cross the intersection before proceeding.,,
turn right onto the street the truck is exiting.,,
proceed forward onto the street where you can see the oncoming vehicle,,
park behind that white car on the left.,,
the guy in blue shirt looks like he is going to cross. stop at the crossing.,,
honk to let the man in blue know he is a bit in the way but continue straight.,,
slow down until the truck has passed ,,
steer very slightly to the left to avoid pedestrian walking on the right,,
slow down to allow the white car to merge,,
slow down and avoid the pedestrians with the grey shirt on the right,,
keep following that white car.,,
pull over behind that truck.,,
turn around and park ahead of that car on the opposite side of the street.,,
"stop near that pedestrian in the distance, we need to pick him up.",,
stop near the guy wearing the white shirt. he needs to ride with me.,,
stop for a minute because i need to ask that man a question.,,
turn right after the end of those barriers.,,
drop me off near my colleague who is walking on our right side in the blue shirt.,,
drop me off near my colleague who is walking on our right side with the black shirt.,,
park behind this truck,,
follow this white people carrier,,
find me a parking spot near that black car on the other side of the road.,,
 make a you turn after the white car has passed.,,
follow that truck,,
continue following the truck turning left.,,
take a left like the truck in front,,
turn around after the bus and park behind it.,,
stop next to the yellow bus,,
if possible turn around and follow the yellow bus,,
follow the truck in front of us,,
stop next to the car on the right,,
stop next to the red barrier that is closest to that truck. ,,
stop next to this bus. i need to get out.,,
get closer to the truck in front,,
go forward once this person is done walking across the street.,,
turn right here and pick up tim who is on the corner.,,
that man on our right is my friend robert. stop near him.,,
take the same direction as the black car on our right.,,
find a parking spot near the silver car on the left lane,,
"pull over, i know this person walking on the sidewalk on the right",,
let us go after that girl safely crossed the road. ,,
turn left and go by that barrier on the left,,
i do not know what this woman with the white top is doing but she is standing in the middle of the street. once she is passed turn to the left please.,,
go straight and parallel park behind the sedan.,,
pull over and unlock the doors so i can pick up my friend standing up ahead on the right.,,
pull next to the orange barrier.,,
parallel park between the white van and the red jeep.,,
make a left in front of that truck up ahead.,,
move into the right lane and go around the cars turning left ahead.,,
drop me off on the corner ahead with the man on the left. ,,
"pull over behind that truck and drop me off, then find a parking spot.",,
make a left and park behind that truck.,,
turn around and follow that white truck,,
pull up to the drivers side window of that pick up so i can say hi to pete,,
proceed towards the car on the right curb and find the closest parking space.,,
there is a parking spot in front of this white van. go there please,,
 hey! this red truck is from my friend! slow down next to it so i can say hi.,,
after this white truck let us turn to the right,,
pull up next to the barrier.,,
drive up to the bicycle,,
turn around after passing the car on the right. ,,
park next to this car,,
steer away from incoming bicycle ,,
park on the left side of this car ,,
stop the car next to the barrier,,
approach traffic cone in slow speed ,,
park next to this car,,
approach this person on a bicycle.,,
park behind the white car.,,
park in the available space next to that car. ,,
park in the available space next to that black car. ,,
park next the closest car over there. ,,
follow the man on the bicycle.,,
back in to the spot next to that last car.,,
pull over by that traffic cone.,,
speed up and get in front of that red van on our right. ,,
could you please park next to that large cone in front of that construction site. ,,
speed up and get behind this pickup truck,,
"i think we can stop here really quick. pull over there by the fence, just behind those orange barriers",,
"let this dark red car pass, then merge behind it",,
turn right at the turn just past that cone,,
we need to go that way. just follow that van that is turning right.,,
go ahead and change lanes so we can get behind the silver car,,
slow down for that pedestrian. ,,
park near the cone on the right.,,
"move behind, and follow this red car.",,
get ahead of the red car on the right and drive up behind the black pickup in front of it,,
james is one of those two guys sitting by those concrete barriers. he is the one on the left. please drop me off in front of him.,,
get behind the dark car in the right turn lane,,
stay right lane on the right side of divider,,
follow the black jeep!,,
