commands/command,Priority,Type
turn left to pick up the pedestrian at the corner,Not safety,Traffic Management
"there he is, follow that white car!",Not Safety,routing
go! catch up to him!,Not safety,Traffic Management
he is getting away! get right behind the white car!,Not safety,routing
pull over to the right and park. greet little timmy and his babysitter,Not safety,parking
continue to follow the car ahead through the yellow light,safety,Traffic Management
let this bmw pass and then switch lanes.,safety,Traffic Management
take a left at the light and park by the first tree where the person is standing. ,safety,parking
there could be pedestrians coming through; leave plenty of room between us and the white car on the right.,safety,Traffic Management
it looks like the truck ahead might be turning right; slow down behind the truck.,stop,Traffic Management
that might be my friend jack by the tree on the right. stop next to him.,stop,Traffic Management
drive up to the right side of that truck in front of us.,Not safety,Traffic Management
park in front of the last vehicle on the right.,Not safety,parking
pull alongside this white vehicle. i like the model and i want to take a better look at it.,Not safety,entertainment
pull alongside the dark suv parked and make a complete stop.,stop,Traffic Management
get next to the truck before us.,safety,Traffic Management
pull up alongside the truck in front of us ,Not safety,routing
keep following the truck in front of us. ,Not safety,routing
pull up next to the pedestrian on our right. the one close to the tree. ,Not safety,Traffic Management
"make a right turn, following this truck.",Not safety,routing
park in front of this black suv,Not safety,parking
pull up on the right of the truck up ahead,Not safety,routing
pull up next to that pedestrian that is standing near that tree on the right. he is going to ride with us.,Not safety,Traffic Management
"hey, pull over by the first pedestrian up ahead on the left. i want to ask for directions.",Not safety,Traffic Management
is that kid over there jim's kid?  pull over and see.,Not safety,entertainment
watch out for that person near the crosswalk up ahead.  he may be crossing right in front of us.,Not safety,Traffic Management
follow that truck up ahead.,Not safety,routing
pull up closer to that truck up ahead.,Not safety,routing
go park over where that other car is.,Not safety,routing
pull over there where that car is.,Not safety,Traffic Management
pull over near that guy on the right side of the road near the corner.  we can give him a ride.,Not safety,Traffic Management
is that jimmy?  i have not seen him in ages.  pull over so we can chat.,Not safety,Traffic Management
let the pedestrian on the right cross the street before turning right. ,safety,Traffic Management
park in front of the second vehicle on our right side,Not safety,parking
stop and wait to see which way that vehicle is going.,stop,routing
that is my friend's bicycle. pull up next to it.,Not safety,Traffic Management
that is my friend. pull up next to her and pick her up.,Not safety,Traffic Management
follow the red car.,Not safety,routing
increase speed and pull up next to the silver car.,safety,Traffic Management
pull up next to that man on our outer right and stop.,stop,Traffic Management
follow the red car.,Not safety,routing
find me a parking spot next to that pedestrian.,Not safety,parking
we found my bike! i'm going to hop on it and ride home now. thanks!,Not safety,Traffic Management
stop next to the woman in front of us standing closest to us.,stop,Traffic Management
stop next to the yellow bicycle,stop,Traffic Management
find a parking spot near the bicycle on the left,Not safety,parking
follow the silver car in front of us,Not safety,routing
follow the red car,Not safety,routing
stay behind this red car until the next light.,Not safety,Traffic Management
stay behind this car until the next light.,Not safety,Traffic Management
follow this car until the next light then turn right.,Not safety,Traffic Management
turn down the street where that car is.,safety,Traffic Management
get ahead of this car and take a right turn.,Not safety,routing
get in front of this car,safety,routing
pass the  intersection before the grey car arrives. ,safety,Traffic Management
continue straight ahead before the pedestrian passes the street.,safety,Traffic Management
"see that bike under the tree, i knew that tom left his bike somewhere near here last night. that might be his bike. pull over next to it. ",Not safety,Traffic Management
follow that red car that is driving on the main road,Not safety,routing
"when that red car has passed the intersection, continue straight",Not safety,routing
"oh, i see kate. she is waiting on the corner. pull over next to her. ",Not safety,Traffic Management
we should go the same direction as the red car that is turning on the other side of the traffic junction. ,Not safety,routing
"once the traffic lights turn green, follow the silver suv",Not safety,Traffic Management
follow this car.,Not safety,routing
turn right after the pedestrian has crossed the street,safety,Traffic Management
"move a bit forward, so we can what is coming from behind that truck.",safety,Traffic Management
stop next to the semi truck on the left.,stop,routing
speed up and pass the truck on our left when the light changes.,safety,Traffic Management
"after that person has crossed, let us go to the right.",safety,Traffic Management
a man is crossing the road. let him pass and then we can go to the right.,safety,Traffic Management
make a quick left before that car from the opposite lane reaches the intersection.,Not safety,routing
pull over next to that pedestrian on the other side of the intersection.,Not safety,Traffic Management
"park in front of the black car on the left, the one that is the last in the line of parked cars",Not safety,parking
park by that man in black,Not safety,parking
do i know that person? pull up beside that person that is running. ,Not safety,Traffic Management
"what is that on the curb? slow down for that thing on the right, i think its a cat. ",safety,Traffic Management
"and there is john! pull up to him, see what he is doing out in the rain. ",Not safety,Traffic Management
stop next to the pedestrian in the black shirt on the left,stop,Traffic Management
stop behind the first car on the left.,stop,Traffic Management
drop me off next to the white car on the left.,Not safety,Traffic Management
continue straight and drop me off next to the box truck.,safety,Traffic Management
i see my contact in front of us. he is the one standing next to his car,Not safety,Traffic Management
what is this child doing all alone on the road? pull up near them!,Not safety,Traffic Management
pick up husband standing next to his car on the right.,Not safety,Traffic Management
"slow down, a truck is ahead.",safety,Traffic Management
be careful. a man may attempt to cross the road.,safety,Traffic Management
turn right after that car,Not safety,routing
oh i think that is a friend who is waiting for me. turn around up ahead so we can park there.,Not safety,Traffic Management
slow down so i can say hi to that person,Not safety,Traffic Management
stop to let him cross,stop,Traffic Management
oh my god we finally found my chicken. stop near it!,Not safety,entertainment
"stop next to that person, i want to ask where i can find a good restaurant.",Not safety,entertainment
make a you-turn near the yellow car.,Not safety,Traffic Management
"there is a person near the curb, i need to get out of there car near him.",Not safety,Traffic Management
park in front of the truck.,Not safety,routing
park next to the person on the left.,Not safety,routing
turn left and pick up my son. he is standing in front of us.,Not safety,routing
pull over next to this bike so i can load it in my car,Not safety,routing
ask this guy on the left for directions to mexican food place,Not safety,entertainment
pick up these people,Not safety,Traffic Management
"slow down and go wide around, that dog is off leash",safety,Traffic Management
park here to pick up steve.,Not safety,parking
slow down to talk to this man about his dog.,safety,entertainment
park in front of this car.,Not safety,parking
let me pick up that bike please! it is mine.,Not safety,Traffic Management
move to the right to give the dog on the left side of the road more space.,safety,Traffic Management
turn right at the blue dumpster.,Not safety,routing
"stop at the bike on the left, it looks like my friend's which was stolen.",stop,Traffic Management
"honk at the man on the left, that is my neighbor steve.",Not safety,Traffic Management
pull up next to the pedestrian waiting by the trash cans. ,Not safety,Traffic Management
this car looks familiar. slow down a bit if you will.,Not safety,Traffic Management
i know the man walking on the left. stop next to him.,stop,Traffic Management
this car is carrying cargo. move a bit to the right and then continue towards our destination.,Not safety,routing
turn left and find a parking place near the large pick-up,Not safety,parking
follow that car.,Not safety,routing
park by that traffic cone.,Not safety,parking
make a you-turn and pull up behind the silver vehicle that is on our left.,Not safety,Traffic Management
pull up next to the pedestrian walking on the left.,Not safety,Traffic Management
move away from that total black truck.,safety,routing
park next to that vehicle that is stationed on the left side of the road.,Not safety,parking
"park near that dog, he is so cute!",Not safety,parking
follow that jeep.,Not safety,routing
turn right past the barrier. ,Not safety,routing
park near that debris.,Not safety,parking
stay to the right of the black car on the left,Not safety,routing
stop for the man ahead in the white shirt,stop,Traffic Management
pass this white truck in the left lane,Not safety,Traffic Management
turn around and follow the grey toyota rav 4,Not safety,routing
make a you turn and follow the white lexus sedan,Not safety,routing
follow that car and take the next right,Not safety,routing
stop next to the women walking her dog,stop,Traffic Management
follow the car in front ,Not safety,routing
stop the vehicle next to the man wearing a white shirt.,stop,Traffic Management
change lanes so we do not hinder the guy in the wheel chair.,safety,Traffic Management
"be on the lookout for john, he should be somewhere around here wearing a black top ",Not safety,Traffic Management
follow the black suv past the wheelchair,Not safety,Traffic Management
move to the left lane to avoid the guy in the wheelchair,Not safety,Traffic Management
please follow that suv.,Not safety,routing
that is my wife's car over on the left. pull up next to it,Not safety,Traffic Management
pull up next to the first traffic cone on the right,Not safety,routing
try to park in front of the first car we meet on the left side of the road. ,Not safety,parking
this poor guy in a wheelchair seems like he is having a hard time to move forward. let me out just before him so i can help him,Not safety,Traffic Management
catch up with the black car in the left lane,Not safety,Traffic Management
wait for that pedestrian to clear the intersection. then continue straight ahead. ,safety,Traffic Management
"let these pedestrians pass, and then turn right",safety,Traffic Management
"when the light turns green, park up behind that truck",safety,Traffic Management
there are two people walk on the crosswalk to the right. we need to pick up the one that is walking on the right side. get over to him. ,Not safety,Traffic Management
let us park behind that bus because i'm in a big hurry. i will go on foot from here,Not safety,parking
"we are about to pass a guy in a wheelchair, pull over next to it. maybe he can come with us. ",safety,Traffic Management
wow slow down! this man is not using the crosswalk and is going to cross the road!,safety,traffic Management
park behind that truck that is way up ahead. ,Not safety,parking
pull over next to the wheelchair,Not safety,Traffic Management
slow down and change lanes behind the black car,safety,Traffic Management
that is jack way up there across the street. can we turn around whenever it is possible? i need to meet him. ,Not safety,Traffic Management
"slow down, stay at least 5 feet behind the man in the wheelchair. ",safety,Traffic Management
"slow down as we approach the bulldozer, i want to see the brand. ",safety,Traffic Management
is there a right turn after that bulldozer? slow down as we approach it so i can see. ,safety,Traffic Management
decrease speed for those pedestrians crossing up ahead. ,safety,Traffic Management
turn into the left lane so we avoid those pedestrians,safety,Traffic Management
"turn into the left lane and slow down, the car ahead is stopping for the pedestrians. ",safety,Traffic Management
change lanes and pass the wheelchair. ,safety,Traffic Management
"pull up next to the man in the wheel chair, i want to see if he needs help. ",Not safety,Traffic Management
take a left into that apartment building. the driveway is right behind the pedestrian ,Not safety,routing
"approach and stop for the boy crossing the street, i think that is who i'm meeting for dinner. ",stop,entertainment
that is my friends car! move into the left lane and follow that car. ,Not safety,routing
merge into the left lane to avoid him.,safety,routing
avoid that construction equipment. merge into left lane.,safety,routing
change lanes to stay away from the man in the wheelchair ,safety,Traffic Management
switch to left lane to pass man in wheelchair ,safety,Traffic Management
switch lanes and follow the black car that is driving in front of us. ,Not safety,routing
there is a spot behind that car on the other side of the road. park behind it. ,Not safety,routing
"keep a lookout over the road for my friend, he should be wearing a black coat",Not safety,entertainment
pull up behind that black car so that i can see the building numbers on the other side.,Not safety,entertainment
we need to park on the other side of the road behind that black car.,Not safety,parking
"pull up next to the guy in the wheelchair, he seems in need of help. ",safety,Traffic Management
"slow down, the car in front of us is switching lanes.",safety,Traffic Management
follow the black to its destination.,Not safety,routing
move over to the left lane after this car passes us.,Not safety,routing
there is a free meter on the right; see if you can parallel park behind that dark sports car.,Not safety,routing
shift to the left lane when you can so we do not get too close to that wheelchair.,safety,Traffic Management
"my building is on the right, so pull up next to this orange billboard",Not safety,Traffic Management
hey wow! there is a man in a wheelchair in front of us. could you stop before him please? i'm going to help him.,safety,Traffic Management
park behind this car next to the pole,Not safety,parking
park in front of this white car,Not safety,parking
stop in front of this car ,stop,routing
follow the person in front of us,Not safety,routing
we should turn where that pedestrian is.,Not safety,Traffic Management
park behind the police car.,Not safety,parking
maybe there is a parking spot after the last parked car on the right. find a parking spot there please.,Not safety,parking
hey! there is a parking spot before the black suv. park there.,Not safety,parking
drop me off near the suv near the trees.,Not safety,routing
my store is just behind the white truck. park there please.,Not safety,Traffic Management
turn after the parked car near the trees.,Not safety,parking
do a you-turn and drop me off behind the ups truck.,Not safety,routing
follow the car in front of me. ,Not safety,routing
turn left before the white truck ahead.,safety,routing
parallel park in front of that black car on the left. ,Not safety,parking
there is my friend bill on the other side of the street.  make the next you-turn and then pull up beside him.,Not safety,Traffic Management
move to the right lane and follow that black car.,Not safety,Traffic Management
go straight ahead until you are within ten meters behind that car,safety,traffic Management
park behind the car on the right side.,Not safety,parking
park right behind that car,Not safety,parking
make a you-turn and park in front of the car on the left side of the road.,Not safety,routing
get in the left lane behind this green truck,Not safety,Traffic Management
"turn right here, but let that pedestrian wearing black cross the road. ",safety,Traffic Management
speed up and pass the truck ,safety,Traffic Management
i do not know why jake is going straight with his silver car but i'm sure we should turn right here.,Not safety,routing
pick up the man on the outer right. ,Not safety,routing
stop behind the tan car,stop,Traffic Management
change lanes to get behind the large green truck. ,Not safety,Traffic Management
avoid the large truck on the left. ,safety,Traffic Management
i see my friend on the corner. make a left turn and stop in front of him. ,Not safety,entertainment
drive straight passed the trailer. ,safety,routing
stay to the right of this emergency vehicle,safety,routing
i need to follow the silver car,Not safety,routing
pull to the right and stop by those pedestrians,stop,Traffic Management
get behind the trailer in the left lane,Not safety,Traffic Management
pick up my husband from the right curb,Not safety,entertainment
pick up the pedestrian next to the lamp post on the right.,Not safety,entertainment
stay in this lane and pass that truck. ,safety,Traffic Management
keep at least 10 feet away from the police vehicle.,safety,Traffic Management
follow the gray sedan that is in front of us. ,Not safety,routing
what are we doing in this lane? we ought to go right here! switch lanes but slow down for that person crossing the road,safety,Traffic Management
park behind that dark car on the right,Not safety,parking
"there is dave's car, can you park alongside that white jeep please",Not safety,parking
"that is a police car on the right, take it easy so we do not get into trouble",safety,Traffic Management
can you actually stop next to this police car? i want to report a crime with them.,stop,Traffic Management
could you let me out near that traffic cone near the building? it is where my work is,Not safety,routing
take me to this white car please,Not safety,routing
go to this last car to our left,Not safety,routing
here's a spot! park in front of this black car here on our right,safety,parking
"let us park right here, behind this gray car on our right hand side",Not safety,parking
pull up right next to that cone in the middle,Not safety,routing
"see if there is more parking over there, near that white utility van, second from right to left in that row of parked cars",Not safety,parking
find a place to park near that big white car on the left. ,Not safety,parking
find a parking spot near the white truck,Not safety,routing
park on the opposite side of the street from this white van next to us.,Not safety,parking
stop next to the bicycles on the left.,stop,routing
find me a parking spot close to the blue jeep.,Not safety,parking
please park close to the white van to the left.,Not safety,parking
find me a parking spot near the black sedan.,Not safety,parking
park close to the black and white van on our left.,Not safety,parking
my wife should be behind this grey jeep. turn and pick her up.,Not safety,entertainment
turn left after the man in the red shirt crosses the street.,Not safety,entertainment
park close to that red jeep.,Not safety,parking
turn right just before the white car,Not safety,routing
turn right just after we pass this car. ,safety,routing
make an you turn and follow this vehicle.,Not safety,routing
please turn around and follow this truck.,Not safety,routing
find a parking spot after this truck passes.,Not safety,parking
please drop me off near the first white car on the left. ,Not safety,entertainment
find a parking spot near that white car on the left. ,Not safety,routing
please drop me off near that car on the other side of the street. ,Not safety,entertainment
pull up next to that bicycle rack. my bike should be there. ,Not safety,entertainment
find a parking spot near the bicycle rack,Not safety,parking
please drop me off in front of the bicycle rack,Not safety,entertainment
turn right at the opposite side of the road from that bicycle rack.,Not safety,routing
"pick up james, he is in front of the bicycle rack",Not safety,entertainment
please drop me off near that blue car across the street from here. ,Not safety,entertainment
paula will meet us at that blue car. pull over next to it. ,Not safety,entertainment
find a parking spot for us near the blue car that is on our left. ,Not safety,parking
find me a parking spot near that white van on the left. ,Not safety,parking
please drop me off near that black car that is parked on the left side of the street. ,Not safety,entertainment
make an you turn and follow this van.,Not safety,routing
turn around and follow this truck.,Not safety,routing
get behind that dhl van in the other lane,Not safety,Traffic Management
change destination and follow that yellow van,Not safety,routing
"i have an appointment with someone near here, pull up behind that black and white police car. ",Not safety,entertainment
"stop near the police car, i want to talk to the officer.",Not safety,routing
find me a parking spot near that police car,Not safety,parking
make an you turn and follow this white van.,Not safety,routing
get behind that white van in the other lane,Not safety,Traffic Management
try to turn around and follow that white van.,Not safety,routing
"that is rogers car over there, the blue one on the left. please find a parking spot nearby.",Not safety,parking
try to park next to that vehicle that is parked on the left side of the street.,Not safety,parking
can you please find a way to turn around and follow this gray car?,Not safety,routing
turn around as soon as possible to follow this car.,Not safety,routing
follow that truck,not safety,routing
follow that black truck,Not safety,routing
turn left after that black truck,Not safety,routing
park near in front of that first white car to the left,Not safety,parking
park next to that vehicle on the left,Not safety,parking
park next to that car on the left,Not safety,parking
park in front of that car parked on the other side of the street,Not safety,parking
park behind that white car over on the left,Not safety,parking
park next to that white car to the left. ,Not safety,parking
park near the bicycle rack,Not safety,parking
turn left after that bicycle rack,Not safety,routing
find a parking space near that bicycle rack,Not safety,parking
park behind that bicycle rack,Not safety,parking
follow that passing car,Not safety,routing
park in front of that blue car,Not safety,parking
park near that blue car,Not safety,parking
find a parking space near that blue car over on the left,Not safety,parking
park alongside that blue car on the left. ,Not safety,parking
park alongside that blue car,Not safety,parking
follow that blue car when it leaves,Not safety,routing
park near that white van,Not safety,parking
park near that white car,Not safety,parking
park behind that white car over on the left,Not safety,parking
park in front of that white car,Not safety,parking
park near that black car on the left,Not safety,parking
slow down near the police vehicle,safety,Traffic Management
turn left after the police vehicle,Not safety,routing
follow the police vehicle,Not safety,routing
find a parking space near that jeep on the left,Not safety,parking
let that person cross the road,safety,Traffic Management
park near that adult in the red shirt,Not safety,parking
slow down and let that pedestrian cross the road,safety,Traffic Management
please pull over near my friend standing by that pole,Not safety,Traffic Management
please find a parking space near that pedestrian over on the left by that pole. ,Not safety,parking
change lanes and park next to that red car on the left,safety,parking
park next to the bicycle rack ,Not safety,parking
park behind the white mercedes on the right,Not safety,parking
pull up alongside that pedestrian walking close to that white car on the right. ,safety,Traffic Management
"go slowly past that white van, i want to read the number plate.",safety,Traffic Management
"go right and get over to that pedestrian, i am kind of lost and wish to ask him for coordinates. ",Not safety,entertainment
stop in in front of the white vehicle,stop,Traffic Management
"the sign behind the white pickup says something, i want to read it, pull up near it.",safety,Traffic Management
follow that dark car through the roundabout.,not safety,routing
"i need to ask for directions, pull over behind this person.",Not safety,entertainment
"we are going the wrong way, make a you-turn before this truck.",Not safety,routing
maintain distance and follow this car to destination,safety,Traffic Management
stop near the emergency vehicle ,stop,Traffic Management
follow this car until we reach the next bank,Not safety,routing
stop the car next to that pedestrian on the far right side of the roundabout,stop,Traffic Management
stop after the sign on that trailer.,stop,Traffic Management
pull over at the sign on that trailer.,stop,Traffic Management
park next to the white suv on the right,Not safety,parking
pull up behind the white suv.,Not safety,routing
follow that car in front of us,Not safety,routing
pull up beside the police car.,Not safety,Traffic Management
